{
  "$schema": "../schemas/relay-measurement-vector.schema.json",
  "directions": {
    "browserToServer": [
      0,
      1,
      16,
      64,
      256,
      512,
      768,
      1024,
      1100,
      1150,
      1175,
      1190,
      1200,
      1210,
      1220,
      1230,
      1240,
      1250,
      1260,
      1270,
      1280,
      1290,
      1298,
      1299,
      1300,
      1301,
      1306,
      1307,
      1308,
      1309,
      1310,
      1311,
      1312,
      1313,
      1314,
      1315,
      1400,
      1401,
      2048,
      4096,
      8192,
      16384
    ],
    "serverToBrowser": [
      0,
      1,
      16,
      64,
      256,
      512,
      768,
      1024,
      1100,
      1150,
      1175,
      1190,
      1200,
      1210,
      1220,
      1230,
      1240,
      1250,
      1260,
      1270,
      1280,
      1290,
      1298,
      1299,
      1300,
      1301,
      1306,
      1307,
      1308,
      1309,
      1310,
      1311,
      1312,
      1313,
      1314,
      1315,
      1400,
      1401,
      2048,
      4096,
      8192,
      16384
    ]
  },
  "formatVersion": 1,
  "framing": {
    "datagramLengthPrefixBytes": 2,
    "relayHeaderBytes": 40,
    "singleDatagramOverheadBytes": 42
  },
  "packedCases": [
    {
      "direction": "browserToServer",
      "sizes": [
        64,
        64
      ]
    },
    {
      "direction": "browserToServer",
      "sizes": [
        16,
        1300
      ]
    },
    {
      "direction": "browserToServer",
      "sizes": [
        1300,
        16
      ]
    },
    {
      "direction": "browserToServer",
      "sizes": [
        256,
        256,
        256,
        256
      ]
    }
  ],
  "payloadIdentification": {
    "minimumTaggedInnerBytes": 16,
    "nonceBytes": 16,
    "placement": "payload-prefix",
    "smallerCasesRunSequentially": true
  },
  "requiredBoundaryBytes": [
    1300,
    1307,
    1309,
    1312,
    1314
  ]
}
